订单号,下单时间,订单总价,订单状态,商品名称
464239935112205,2025-03-09 15:11:34,29.6,待收货,脏衣篓可折叠家用卫生间浴室高颜值大容量洗衣篮子脏衣篮推车收纳
464239768015158,2025-03-09 15:10:54,18.9,待收货,遥控器磁吸收纳壁挂挂墙免打孔无痕贴路由器家用空调插排收纳神器
777289677094965,2025-03-09 14:53:25,31.24,待收货,夹子智能底座支架适用小米萤石摄像头室内机免监控打孔婴儿床侧装
464240143457280,2025-03-09 14:51:08,15.36,待收货,监控摄像机支架免打孔室内适用乔安小米乐橙萤石小米家华为TPLINK
,2025-03-09 14:46:47,14.5,未发货，退款成功,免打孔免粘贴夹子式摄像头监控支架通用萤石小米云台乔安乐橙华为
464239987493284,2025-03-09 14:43:02,36,待收货,落地式适用于小米萤石乐橙摄像头家用便携移动固定神器监控支架
,2025-03-09 14:38:24,18,未发货，退款成功,免打孔监控摄像头支架TPLINK小白萤石云360乐橙倒吊装婴儿床支架
,2025-03-09 14:37:40,26,未发货，退款成功,免打孔监控摄像头支架TPLINK小白萤石云360乐橙倒吊装婴儿床支架
78487829334037,2025-03-06 07:04:48,14.9,待收货,汽车儿童安全带调节固定器辅助带宝宝防勒脖限位器1-3-12岁通用款
464230895036127,2025-03-06 07:02:25,19.4,待收货,天然乳胶水滴杯胸垫显胸大聚拢美背加厚胸罩内衣垫文胸垫插片薄款
503490438851,2025-02-25 11:16:11,￥59.9,待评价,巴布豆男童运动鞋2024春秋季新款网面儿童鞋子旋转纽扣轻便休闲鞋
631288576158,2025-02-21 10:16:52,￥6.11,待评价,创意大眼呆萌怪兽彩色冰箱贴洞洞板装饰入户门磁铁磁力贴吸铁石
636179047979,2025-02-20 16:32:46,￥17,待评价,情绪盒子卡牌 情绪认知管理卡牌 情绪疗愈 网红爆款桌游
263735083906,2025-02-20 16:30:46,￥11.52,待评价,记忆索引卡便签纸ins高颜值便签无粘性便利贴笔记文具英语单词卡
669262918701,2025-02-19 17:36:07,￥25.8,待评价,日本蜡烛图技术正版金融类期货炒股投资理财新手入门股票书籍
604588817113,2025-02-19 17:35:14,￥15,待评价,高效能人的七个习惯 英文原版 The 7 Habits of Highly Effective
623676738246,2025-02-19 17:33:10,￥10,待评价,现货英文原版富爸爸穷爸爸Rich Dad Poor Dad2更新版 实体版
603944193641,2025-02-19 17:32:39,￥11,待评价,思考致富 英文原版 Think and Grow Rich 拿破仑希尔 经典励志
576487439758,2025-02-19 17:31:18,￥7.9,待评价,现货 原子习惯 建立好习惯英文版 Atomic Habits
577162897406,2025-02-19 17:30:59,￥7.9,待评价,金钱心理学The Psychology of Money - hardback 英文纸质书 现货
662616376836,2025-02-19 17:30:48,￥14.8,待评价,宏观思考的力量 The Magic of Thinking Big David J Schwartz
601775578240,2025-02-19 17:28:48,￥11.8,待评价,有钱人想的和你不一样 英文版 Secrets of the Millionaire Mind
433505224149,2025-02-17 23:32:50,￥18.87,待评价,吉他墙壁挂钩 吉他尤克里里小提琴贝斯吊架琴行培训班挂架乐器架
593113080424,2025-02-17 22:26:11,￥19.7,待评价,顾家 人体感应小夜灯不插充电光控声控厕所家用楼梯过道超亮智能
618755503468,2025-02-17 22:20:26,￥15.04,待评价,出口版丁腈手套家务清洁厨房耐磨耐用商务家用干活手套防护食品级
693715764575,2025-02-17 21:52:29,￥6.86,待评价,多巴胺风铃吸门式入户磁吸木质门铃商铺进门提醒铃铛新中式装饰
643854664471,2025-02-17 21:50:37,￥2.3,待评价,创意个性马桶贴可爱搞笑脸卫生间马桶盖贴画装饰卡通涂鸦防水贴纸
701283792706,2025-02-17 21:49:42,￥2.77,待评价,小红书新款哪吒闹海动漫周边结界兽冰箱贴装饰收藏礼品【3月7日发完】
683972634484,2025-02-17 21:47:00,￥14.87,待评价,可爱卡通门把手套防磕碰防撞门把手保护套儿童房家装装饰把手护套
673110065893,2025-02-17 21:42:58,￥3.9,待评价,多巴胺浴室挂钩免打孔强力承重粘胶门后无痕挂衣钩卫生间毛巾粘钩
647433706811,2025-02-17 21:40:14,￥10.9,待评价,超可爱挂式双层吸水手巾加厚速干卫生间厨房毛巾面巾手帕卡通儿童
696061719332,2025-02-17 21:36:17,￥3,待评价,爆款派大星马桶箱按压器长指甲美甲专用创意卫生间冲水开关辅助器
642159111349,2025-02-17 21:33:08,￥4.17,待评价,新款马桶提盖器笑脸小丑马桶盖掀开创意家用厕所把手防脏柜子垃圾
673503014980,2025-02-17 21:31:37,￥5.01,待评价,【两件套】简约创意不规则花瓶透明玻璃客厅桌面插花ins装饰摆件
399539456661,2025-02-17 21:30:34,￥19.8,待评价,车载纸巾盒汽车用扶手箱抽纸盒车内装饰挂式创意可爱卡通毛绒纸抽
656522792955,2025-02-17 21:29:19,￥12.12,待评价,小红书同款炸毛小狗车载垃圾袋可爱卡通可粘贴学校课桌垃圾袋
652377649821,2025-02-17 21:28:46,￥5.54,待评价,爆款汽车通用车载座椅椅背隐藏式多功能挂钩后排车内创意收纳神器
624689493918,2025-02-17 21:17:15,￥5.84,待评价,抖音同款网红汽车贴纸卡通兔子警官狐狸个性车贴创意侧窗玻璃贴画
694096758529,2025-02-17 21:11:09,￥8.9,待评价,找几只小毛怪玩玩可爱治愈电脑桌面日式工位办公桌小摆件
435706105440,2025-02-17 21:10:30,￥8.4,待评价,小王子摆件迷你Ins风摆件治愈系小王子系列礼物蛋糕高级感装饰品
479536979760,2025-02-17 21:05:50,￥11.77,待评价,日系宫崎骏小煤球汽车摆件可爱饰品电动车车载中控台后视镜小摆件
558497596782,2025-02-17 21:01:12,￥14.94,待评价,桂花车载香薰汽车圆形出风口装饰香水扩香石车内饰品摆件奔驰香氛
659996769753,2025-02-17 17:54:16,￥1.26,待评价,苹果Applepencil笔尖套一代2防滑1降噪静音二代笔套笔尖膜ipad薄
634077738091,2025-02-17 17:53:34,￥3.46,待评价,平板iPad笔尖一二代磁吸笔帽转接头笔头配件适用苹果Apple pencil
655042162302,2025-02-09 15:45:24,￥18.8,交易成功,儿童识字3000字幼儿认字卡片象形看图汉字宝宝早教启蒙卡全套玩具
659824380737,2025-02-09 15:42:18,￥9.79,交易成功,宝宝认知早教书0到6岁撕不烂唐诗三百首国学启蒙三字经弟子规儿歌
667657757554,2025-02-09 15:38:38,￥29.99,交易成功,【升级版】点读版小猪佩奇台词本剧本字幕本粉猪大字版贴纸120g纸
238259277419,2025-01-14 16:14:34,￥58.95,交易成功,儿童益智早教教具科学实验套装儿童节礼物男孩生日礼物手工材料包
682039456864,2025-01-02 16:14:44,￥49.21,交易成功,梦幻星空马克杯鱼尾人鱼陶瓷咖啡杯铜章鱼鳞铜牌办公个性带盖水杯
534463041820,2024-12-31 20:55:56,￥6.9,交易成功,宫崎骏吉喳龙猫汽车窗边中控台摆件车载装饰品可爱治愈系车内手办
656511010077,2024-12-27 19:57:30,￥1.52,交易成功,高清防雾护目镜打磨防疫防尘防风沙飞溅粉尘切割防护眼镜骑行防爆
50881645798,2024-12-27 19:56:51,￥84.91,交易成功,角磨机家用切割机小型多功能磨光机打磨机电动工具手磨机手砂轮机
591166166716,2024-12-27 19:37:32,￥11.31,交易成功,不锈钢角码直片连接件连接码一字直片铁片平角片家具椅子加固配件
589351138130,2024-12-15 17:53:19,￥4.99,交易成功,和尚头包包奶嘴扣环箱包带环手机改造螺丝钉工具配件带圈拉环
680779803049,2024-12-06 22:12:58,￥10.12,交易成功,彩虹刮画diy点彩儿童趣味彩色书签手工画纸幼儿园明信片玩具
529260972669,2024-12-06 11:51:58,￥30.24,交易成功,鞋柜分层隔板柜内隔层板柜子鞋子置物架收纳架多层省空间分格鞋托
144680292933,2024-12-06 11:39:59,￥12,交易成功,加厚不锈钢瓷砖挂钩码配件木地板陈列展示固定托架加厚方形玻璃夹
617434721455,2024-12-06 10:35:47,￥39.8,交易成功,燃气遮挡罩热水器管道遮丑挡板煤气罩燃气炉装饰遮挡收纳.洞洞板
657088774055,2024-12-06 10:31:31,￥18.8,交易成功,厨房收纳神器橱柜门内侧连排挂钩免打孔粘贴多功能滑动轨道挂钩
481694064347,2024-12-06 10:29:48,￥14.6,交易成功,加厚三面角码固定90度直角支架角铁层板托橱柜挂码床角码加固配件
616828879837,2024-12-06 10:29:14,￥9.9,交易成功,90度直角铁层板托L型加厚角码角铁木板桌椅橱柜衣柜固定连接件
633917786677,2024-11-28 20:20:17,￥2.41,交易成功,高品质手机挂绳背夹贴片通用结实手机链手机壳专用防丢固定板夹片
627748884572,2024-11-24 21:43:54,￥13.85,交易成功,【清仓】挂帽子收纳神器衣柜门后衣帽挂钩收纳包包围巾多层挂架
229174290438,2024-11-24 21:40:58,￥41.5,交易成功,家居厨房洞洞板货架定做洞洞板展示架五金工具挂板手机配件饰品架
589351138130,2024-11-24 20:16:06,￥4.99,交易成功,和尚头包包奶嘴扣环箱包带环手机改造螺丝钉工具配件带圈拉环
606377417602,2024-11-13 14:15:42,￥8.99,交易成功,海绵宝宝ins高颜值汽车座背椅挂钩车载收纳车内装饰用品卡通钩子
467241795580,2024-11-13 14:03:25,￥7.8,交易成功,真软皮质感车载纸巾盒高级车内抽纸收纳汽车载纸巾包创意座椅绑带
469760326757,2024-11-13 13:48:48,￥3.3,交易成功,个性车载杯垫汽车水杯槽垫高档车内装饰用品防滑垫置物垫潮新款
625132351138,2024-11-07 16:20:12,￥8.3,交易成功,适配科沃斯扫地机器人配件T5T8T9X1T10N5N8X1X1S原装滚刷盖板罩子
487738808305,2024-11-07 16:12:53,￥36.26,交易成功,抱枕芯靠枕芯买一送一沙发靠背内胆腰枕芯子饱满方形靠垫枕芯定制
3230675233,2024-11-07 16:08:03,￥4,交易成功,双面胶强力汽车专用薄胶带无痕海绵防水耐高温固定车用粘胶贴
542028602490,2024-11-07 16:04:46,￥15.95,交易成功,u型卡封边镶边轨道滑道冰箱橱柜抽屉收纳装饰条收口加厚挂墙凹槽
502738262790,2024-11-07 16:01:12,￥29.2,交易成功,白色置物架盒子长方形无盖厨房烧烤超市食品盒麻辣烫凉菜炸串串
206598376141,2024-11-07 15:49:54,￥6.92,交易成功,宜家代购斯马克厨房橱柜抽屉收纳盒餐具分格西餐刀叉筷分格整理盒
665949006718,2024-11-07 15:47:26,￥34.84,交易成功,超市便利店零食盒斜口散称货架陈列盒喜士多小食品透明收纳盒专用
636625579578,2024-11-07 15:44:59,￥11.18,交易成功,加厚桌面收纳筐玩具零食收纳篮杂物家用长形收纳盒浴室厨房置物篮
413733825908,2024-11-07 15:39:30,￥17.5,交易成功,抽屉分隔收纳盒多格自由组合厨房分格整理盒内裤杂物整餐具整理盒
657450156754,2024-11-07 15:37:08,￥6.8,交易成功,多功能长条收纳盒收纳分隔神器橱柜清仓无盖长方形桌面零食手机壳
529260972669,2024-11-07 11:03:23,￥30.24,交易成功,鞋柜分层隔板柜内隔层板柜子鞋子置物架收纳架多层省空间分格鞋托
601671815305,2024-11-06 23:28:29,￥12.18,交易成功,理发店男士胡须刷猪鬃毛多功能鞋刷造型刷碎发刷油头刷清洁刷
89816803548,2024-11-02 07:51:11,￥13.8,交易成功,【高品质】儿童棉拖鞋女童男童小孩宝宝居家用亚麻地板春秋冬室内
508890108261,2024-10-28 16:48:15,￥2.06,交易成功,登山杖尖保护套户外登山杖胶套耐磨杖尖套防滑登山杖配件保护杖尖
549436817964,2024-10-26 13:45:20,￥9.89,交易成功,男童拖鞋冬季儿童棉拖2022新款冬家居男孩毛毛恐龙卡通保暖毛鞋男
506266783740,2024-10-13 16:34:40,￥7.89,交易成功,垫发梳女头顶增高蓬松自然仿真垫发器隐形无痕高颅顶神器演出盘发
595362923419,2024-10-09 17:01:23,￥3.81,交易成功,ins多巴胺手腕短款手机腕带挂件通用钥匙扣手绳结实手提挂绳
135765815690,2024-10-09 16:38:24,￥6.48,交易成功,厂家直销5v发热片暖脚宝坐垫抱枕护腰护膝暖宫usb加热片diy发热布
212109504735,2024-10-09 16:38:04,￥7.72,交易成功,暖手鼠标垫加热片备用鼠标垫加热片暖脚宝加热片
537168400298,2024-10-09 13:27:41,￥12.82,交易成功,科沃斯扫地机器人配件地宝T5/T8/T9/N5/N8 DJ65原装滚刷主清洁刷
199694818383,2024-10-09 09:21:55,￥24.75,交易成功,儿童罩衣幼儿园宝宝吃饭围兜防水防油小孩防脏饭兜婴儿吃饭围裙
520402813607,2024-10-09 09:21:29,￥31.8,交易成功,儿童罩衣秋冬季新款PU全身防水防油宝宝长袖饭兜婴儿围裙外穿按扣
649326264913,2024-09-27 19:38:16,￥6.12,交易成功,2024儿童皮筋扎头发小公主高弹力毛巾圈不伤发宝宝发圈
572077356299,2024-09-01 08:14:09,￥13.38,交易成功,86型通用浴霸开关琴键五开四开浴室用开关暖风5合1卫生间开关面板
447494275348,2024-08-28 20:30:30,￥22.1,交易成功,金刚砂魔力擦锅底清洁除垢海绵刷锅神器擦去铁锈污渍洗碗海绵擦锅
220833208444,2024-08-08 11:50:31,￥35.19,交易成功,特价狗狗尿垫宠物尿片狗尿不湿宠物用品泰迪猫兔隔尿垫加厚批发
616828879837,2024-08-07 21:14:52,￥9.9,交易成功,90度直角铁层板托L型加厚角码角铁木板桌椅橱柜衣柜固定连接件
481694064347,2024-08-07 21:09:09,￥14.6,交易成功,加厚三面角码固定90度直角支架角铁层板托橱柜挂码床角码加固配件
371182385031,2024-08-07 07:40:18,￥2.47,交易成功,GoPro运动相机配件通用型长螺丝 防水壳面罩固定大疆M5长直螺杆帽
281597686485,2024-07-23 13:59:04,￥26.67,交易成功,全4册象形启蒙识字翻翻书幼儿园认字大全看图识字神器学前识字书
620894507474,2024-07-23 13:55:39,￥16.71,交易成功,秘鲁进口牛油果6个装 新鲜当季孕妇水果宝宝辅食整箱大果包邮
550679778486,2024-07-23 13:53:38,￥13.46,交易成功,【斗半匠】趣记小学必背古诗词75+80首图像记忆法巧记古诗词
558489698818,2024-07-19 12:21:05,￥4.6,交易成功,儿童彩色水滴印花bb夹卡通小女孩前额刘海碎发夹宝宝侧边夹子头饰
553996396027,2024-07-16 14:00:49,￥22.97,已发货，退款成功,泰迅适用GoPro12/11/10运动相机磁吸快拆转接座影石Insta360 x3
614329628361,2024-07-01 10:58:42,￥7.9,交易成功,华为 P20手机壳全包防摔软壳磨砂液态硅胶壳纯色壳保护套新款男女
205661946733,2024-06-27 16:56:01,￥29.7,交易成功,德国工艺99高倍非球面光学放大镜镜面高清高倍放大镜老人阅读看报
609100968862,2024-06-26 08:12:29,￥35,已发货，退款成功,露露新款女士防滑运动骑行手套半指减震健身护掌训练单杠撸铁手套
588987679083,2024-05-15 13:15:59,￥10.9,交易成功,高压通马桶家用真空疏通器下水道厕所强力手动工具卫生间厨房堵塞
258897365741,2024-05-13 07:47:26,￥11.16,交易成功,【吉他背带】民谣吉他背带电吉他尤克里里背带男女经典款斜跨肩带
606344080989,2024-04-18 20:24:52,￥9.79,交易成功,铝塑板墙贴自粘仿瓷砖格子卫生间奶茶店厨房墙面装饰防水防潮贴纸
110871754314,2024-04-17 11:45:23,￥73.92,交易成功,2024新版3D立体图约1.1米*0.8米中国地形图世界地形三维凹凸地图
578952465503,2024-04-15 15:30:04,￥11.69,交易成功,无痕粘钩强力粘墙卫生间创意免打孔挂钩贴墙强力可爱门后钥匙宿舍
431417048628,2024-04-12 15:22:01,￥19.79,交易成功,探秘我们的身体揭秘系列儿童翻翻书3d立体书幼儿绘本人体结构全书
517132672397,2024-04-12 15:16:40,￥12.49,交易成功,人体器官玩具人体骨架模型仿真医学拼装躯干结构内脏科教类玩具
593152394915,2024-04-07 09:21:07,￥21.7,交易成功,防震EPE珍珠棉卷材打包泡沫垫保温防湿填充快递包裹 防震搬家包装
447111333817,2024-04-06 10:55:26,￥9.78,交易成功,门缝底部密封条门缝门底密封条洗手间门挡水条卫生间防水条挡水条
570784266511,2024-04-03 15:07:27,￥16.98,交易成功,除胶剂家用窗户玻璃门太阳膜玻璃贴纸汽车玻璃旧膜强力除胶清洗剂
502282393629,2024-04-02 10:19:03,￥9.9,交易成功,清洁厨房灶台油烟机水槽清洁刷七件套强力去油污铲刀多功能缝隙刷
351511208617,2024-03-30 18:51:56,￥5.8,交易成功,婴幼儿发夹女宝宝发量少全包布不伤发汗毛夹发卡夹子头饰儿童发饰
284632357231,2024-03-30 18:40:23,￥5.68,交易成功,儿童皮筋儿扎头发宝宝发绳婴幼儿手指发圈扎头发橡皮筋小女孩头绳
361224974189,2024-03-28 18:18:57,￥13.88,交易成功,胶带米黄快递电商装箱封口打包黄色胶带胶纸胶布大卷整箱定制批发
330013790521,2024-03-28 18:12:10,￥4.42,交易成功,全新塑料绳子打包绳捆扎绳包装绳扎口绳蔬菜捆绑绳透明尼龙包扎绳
424052114692,2024-03-28 17:25:00,￥10.74,交易成功,防震EPE珍珠棉卷材打包泡沫垫宽30/50cm快递缓冲防碎填充绵包装膜
251030776039,2024-03-28 17:23:24,￥16.98,交易成功,【20个装可粘贴双滚珠滑轮】五金家用小家具底部免打孔助力万向轮
506065591663,2024-03-28 17:05:50,￥5.55,已发货，退款成功,防卡扣塑料胶带器透明胶带座手持胶带打包机封箱器新款切割器
541872316109,2024-03-28 17:01:30,￥29.8,交易成功,批发电商物流纸箱批发定制快递箱子打包盒纸箱快递打包物流周转箱
484103326897,2024-03-28 16:10:56,￥34.22,交易成功,搬家打包膜保护薄膜拉伸膜缠绕膜大卷工业缠绕膜神器打包膜包装膜
591051587203,2024-03-23 14:33:35,￥21.78,交易成功,UPF50+防晒遮阳帽女款防紫外线夏季加大帽檐骑行空顶uv冰丝太阳帽
192982763167,2024-03-23 12:07:08,￥24.87,交易成功,儿童雨鞋时尚可爱轻便防滑雨靴宝宝幼儿男童女童小童小孩水靴水鞋
593998302786,2024-03-19 12:46:41,￥8.79,交易成功,DIY书签手工自制收集春天瓶子书签透明树叶学生创意手工制作书签
226781734577,2024-03-06 20:42:35,￥2.76,交易成功,创意幸运星星瓶子透明玻璃瓶迷你漂流瓶许愿瓶木塞卡口瓶空瓶带盖
472025277248,2024-03-03 18:04:57,￥20.96,交易成功,【特价推荐】正宗甘草金桔干滋润喉咙冰糖金桔天山雪桔休闲小零食
485871354925,2024-03-01 12:00:01,￥13.28,交易成功,爱格各类拖把布通用替换布海绵头喷水纤维拖布头无纺布胶棉拖把头
589842203867,2024-02-28 09:25:41,￥22.1,交易成功,金刚砂魔力擦锅底清洁除垢海绵刷锅神器擦去铁锈污渍洗碗海绵擦锅
555003051490,2024-02-02 12:43:56,￥9.79,交易成功,新年礼物包装纸中国风高级生日书皮纸复古文艺彩色礼品纸超大尺寸
461837095130,2024-01-26 17:25:14,￥3.5,交易成功,儿童口哨玩具宝宝伸缩小吹龙吹卷吹吹卷幼儿园小礼品喇叭生日道具
208664317815,2024-01-26 17:18:02,￥16.94,交易成功,身体扭扭乐转盘扭扭乐twister娱乐平衡地毯聚会游戏亲子游戏玩具
577137290519,2024-01-26 16:51:14,￥9.79,交易成功,新年春节挂件龙年装饰立体新款2024灯笼手工生肖挂饰布置儿童手提
577137290519,2024-01-26 16:50:56,￥9.79,交易成功,新年春节挂件龙年装饰立体新款2024灯笼手工生肖挂饰布置儿童手提
,Invalid Date,0,已取消,No goods
547066287250,2024-01-12 19:43:18,￥15.8,交易成功,新中式爆款月亮发簪复古设计古风发饰现代简约盘发簪子个性头饰女
423949687032,2024-01-09 15:19:09,￥5.9,交易成功,防撞门把手福字静音防撞垫门后墙面客厅卧室关门缓冲垫硅胶保护垫
447700009344,2024-01-03 12:50:14,￥36.9,交易成功,一次性马桶刷套装刷头可抛更换家用卫生间挂墙式宿舍洗厕所刷子
444204991326,2023-12-05 15:59:21,￥19.79,交易成功,正品凡士林水润护脚膏护足霜脚后跟开裂防裂滋润皲裂膏护手霜修复
529580045866,2023-11-28 14:07:31,￥48.76,已签收，换货/补寄成功,304不锈钢风帽防风罩新风外墙排风口油烟机防雨罩出风口网罩排气
409284414837,2023-11-12 12:12:49,￥3.59,交易成功,【简单换眼镜鼻托】硅胶气囊眼镜托鼻托防压痕超软防滑增高鼻托垫
291993461882,2023-11-08 11:58:28,￥23.58,交易成功,PVC国标弯头排水管90度双承插直角弯塑料下水管配件50 75 110 160
487539341930,2023-11-08 11:57:40,￥24.53,交易成功,pvc排水管抽油烟机配件下水管加粗塑料管材管件外直径160 180 200
481589504620,2023-11-07 22:10:52,￥29.47,交易成功,万能型床底支撑架横梁实木床板支撑架床架子床底承重支架撑加固柱
471904688849,2023-11-07 22:04:12,￥22.58,交易成功,免打孔可调节支撑脚家具脚沙发脚茶几柜脚床腿电视柜支撑柱加增高
493616772493,2023-11-06 16:38:15,￥28.47,交易成功,我的情绪小怪兽3册情绪小怪兽去上学旋风小鼹鼠少儿图画书绘本
223285537707,2023-11-02 17:57:24,￥5.8,交易成功,魔力彩虹圈玩具儿童益智七彩魔术弹力圈夜发光大号成人塑料弹簧圈
265417013515,2023-11-01 13:05:14,￥15.79,交易成功,晨光油画棒幼儿园无毒24色48色不脏手可水洗蜡笔儿童画画笔套装
472235989305,2023-11-01 13:02:02,￥9.28,交易成功,厂家直销批发丙烯颜料条无毒儿童颜料娃娃12色diy石头画小盒装3ml
365302537046,2023-11-01 12:14:14,￥104.77,交易成功,飞利浦吸顶灯led灯芯磁吸灯条替换荧光灯板灯贴模组节能高亮光源1
262198775840,2023-10-31 07:37:13,￥20.7,交易成功,布艺沙发清洁剂科技免水洗强力去污家用免洗剂地毯床垫清洗剂神器
530183311368,2023-10-31 07:35:21,￥13.7,交易成功,椅子脚垫凳子腿保护套桌椅脚垫防滑椅子静音耐磨家通用保护带包凳
255039812440,2023-10-31 07:34:14,￥12.79,交易成功,儿童围裙幼儿园美术绘画画衣定制宝宝吃饭围兜防水防脏男女孩罩衣
67147443364,2023-10-31 07:32:35,￥23.5,交易成功,超护食品级一次性手套pvc防水防油家用美容卫生加厚烘焙食用手套
301479565592,2023-10-31 07:31:45,￥10.89,交易成功,妙洁保鲜膜食品级家用大卷PE点断式一次性耐高温冰箱冷藏厨房用品
182499736800,2023-10-18 07:20:45,￥8.79,交易成功,脚后跟贴防掉跟神器防磨脚乐福鞋高跟鞋帖半码垫鞋大改小调鞋码女
395812062726,2023-10-11 20:40:54,￥15.64,交易成功,厨房点火器长打火机煤气灶充电创意防风脉冲点火枪USB电子点火棒
478074067000,2023-10-08 15:49:23,￥12.82,交易成功,创意儿童节日小礼品幼儿园生日礼物扭蛋球玩具学生奖品水果橡皮擦
495292833287,2023-10-07 13:30:46,￥10.77,交易成功,2023款暑假自律打卡本每日学习计划本日历台历自我管理时间安排表
220847800815,2023-09-29 18:50:28,￥14.74,交易成功,2023网红泡泡机吹泡泡机儿童电动全自动发光网红海豚吹泡泡枪闪光
515095005805,2023-09-16 19:30:44,￥11.4,交易成功,家韵浴室置物架壁挂三角架卫生间厕所淋浴房洗澡沐浴露收纳三角篮
316330021436,2023-09-16 19:19:39,￥2.89,交易成功,挂钩强力粘胶不锈钢厨房浴室毛巾挂衣钩强力免打孔墙壁挂衣架粘钩
497859359834,2023-08-29 16:56:17,￥8.9,交易成功,蓬松高颅梳大骨梳大弯排骨梳发根蓬松气囊梳子按摩头皮梳女士专用
493244395163,2023-08-29 16:53:37,￥12.89,已发货，退款成功,绿檀黑檀木发簪女高级感花朵气质盘发簪子现代简约新中式发钗木簪
370721855428,2023-08-29 16:48:40,￥11.89,交易成功,网红金属大号抓夹女韩国头发气质夏季发夹后脑勺发卡鲨鱼夹子头饰
204999009144,2023-08-29 16:44:47,￥37.97,交易成功,美添乐胶棉拖把吸水大号海绵拖把头
490403964450,2023-08-25 10:28:15,￥28.78,交易成功,儿童定制姓名姓名贴大号学生不掉幼儿园用品入园必备刺绣印书包
412581814876,2023-08-20 08:12:31,￥66.81,交易成功,泰迅GoPro11/10/9挂脖360X2 360X3大疆相机磁吸挂脖支架固定配件
346677466180,2023-08-17 20:56:29,￥59.14,交易成功,a类抗菌防螨夹棉巨厚床笠1.8米2米席梦思全包围床垫床罩防尘床套
364322543000,2023-08-12 09:09:01,￥14.49,交易成功,浴室地板刷洗地缝刷卫生间刷地刷瓷砖长柄洗墙厕所刷子硬毛马桶刷
498657401160,2023-08-10 10:12:28,￥6.49,交易成功,多功能浴室缝隙清洁刷卫生间门缝窗户硬毛刷子长柄长条家用窄夹缝
505042787539,2023-08-10 10:06:05,￥11.49,已发货，退款成功,加大号13cm高级感波浪抓夹女款发量多夹子头饰发夹后脑勺发抓盘发
382822998710,2023-08-10 10:01:16,￥8.89,交易成功,贝壳帽发箍帽子配件 蕉下遮阳帽维修发箍帽配件空顶帽辅料防晒帽
470529353406,2023-08-08 11:14:32,￥61.91,交易成功,纯英文绘本儿童启蒙认知胶装幼儿园小学英语辅导班英语启蒙故事书
375276081252,2023-08-06 09:34:36,￥27.87,已评价,幼儿园姓名贴熨烫儿童名字贴纸防水撕不烂定制免缝自粘印书包衣服
470529353406,2023-08-05 16:14:45,￥61.91,已发货，退款成功,纯英文绘本儿童启蒙认知胶装幼儿园小学英语辅导班英语启蒙故事书
429571583553,2023-08-05 15:00:12,￥29.77,交易成功,赖马绘本全套13册生气王子爱哭公主我变成一只喷火龙了早起的一天【8月19日发完】
119258878268,2023-08-05 14:41:45,￥27.7,交易成功,机械键盘防尘罩台式透明亚克力鼠标保护套104键87键盘盖定制图案
236000777046,2023-08-04 10:31:06,￥9.17,已发货，退款成功,魔力纳米双面胶无痕双面胶贴高粘度透明强力固定墙面万能双面胶带
295286728584,2023-07-30 09:01:40,￥178.81,交易成功,好奇金装成长裤超薄透气新品婴儿用品尿不湿拉拉裤多规格可选
