订单号,下单时间,订单总价,订单状态,商品名称
2068241424,2022-06-15 19:14:45,￥10.02,交易成功,18片英国优步熊婴儿游泳裤幼宝宝一次性泳裤游泳纸尿裤防水拉拉裤
243147624157,2022-06-14 10:15:20,￥8.49,交易成功,书架简易桌上固定书本书立片书挡板收纳神器伸缩铁书夹子特价清仓
96422362028,2022-06-09 16:48:54,￥12.9,交易成功,双头荧光笔学生做笔记划重点标记套装彩色笔一粗一细高颜值记号笔
349483997007,2022-06-09 12:45:15,￥19.89,交易成功,男女宝宝防蚊裤夏季纯棉薄款睡裤婴儿春秋外穿灯笼裤儿童休闲长裤
143076068076,2022-06-09 12:40:17,￥106.81,交易成功,好奇金装成长裤超薄透气拉拉裤小内裤婴儿用品尿不湿男女宝宝通用
337980474859,2022-06-06 15:39:04,￥3.91,电子券码已使用,公文写作范例大全： 格式、要点、规范与技巧（第2版）pdf电子书
273683883918,2022-06-06 13:02:10,￥3,电子券码已使用,PDF电子书pdf/应用文写作 第5版 夏晓鸣,全国翻译硕士MTI考试、公
332144096313,2022-06-06 12:59:30,￥63,已评价,正版 汉语写作与百科知识 刘军平 2023全国翻译硕士专业学位MTI考
308200147785,2022-06-06 12:50:27,￥0.98,交易成功,英汉翻译教程-修订版-张培基2018-PDF电子版教材
366355972391,2022-06-06 12:48:53,￥47,交易成功,英译中国现代散文选 全册1-4套装张培基 汉英对照 散文佳作108篇
267137574462,2022-06-06 12:45:29,￥18.31,交易成功,正版 散文佳作108篇 英汉双语对照 乔萍 译林出版社 可搭张培基
265686915378,2022-06-06 12:42:14,￥22.53,交易成功,华研英语专八真题集训预测卷2022 专8级阅读听力翻译改错词汇作文
7308440037,2022-06-06 12:41:25,￥29.87,交易成功,华研外语2022专八阅读 大学英语专业八级阅读理解180篇专项训练
162538618497,2022-06-06 12:32:49,￥19.89,交易成功,华研外语专四语法与词汇1000题 专业四级英语词汇语法专项训练
306685677018,2022-06-05 20:08:26,￥8.49,交易成功,apple pencil笔尖苹果一二代磁吸笔帽转接头手写笔头原装配件替换
205530874781,2022-05-27 07:42:16,￥17.49,交易成功,宜家IKEA洛奇小孩儿童坐便器凳宝宝婴儿便盆婴幼儿童马桶男女通用
339249770323,2022-05-26 22:16:17,￥10.49,交易成功,洗手间地垫吸水速干耐脏浴室地毯卫生间脚垫厕所门垫硅藻泥软垫
264040927849,2022-05-24 21:19:55,￥59,交易成功,B.Duck小黄鸭儿童滑板3-6岁8初学者12专业男孩女生双翘四轮滑板车
345871659228,2022-05-18 22:17:41,￥7.9,交易成功,速干擦手球雪尼尔北欧可爱清新厨房加厚手帕浴室速干清洁挂式毛巾
221058282352,2022-05-18 22:14:26,￥13.76,交易成功,纳米窗纱高档纳米纱窗网防蚊防晒自装纱窗纱网家用隐形纱窗免打孔
186937278606,2022-05-18 21:14:51,￥17.9,交易成功,虹起电动打蛋器自动打发器搅拌器手持蛋清蛋糕鸡蛋奶油奶粉适用
164357288018,2022-05-18 18:23:52,￥7.69,交易成功,大盘家用儿童孕妇清香盘香杀蚊有效驱蚊蝇飞虫蚊香桶装黑蚊香批发
279723136092,2022-05-15 22:36:46,￥8.9,交易成功,鞋子除臭剂去味吸异味除味剂神器鞋袜鞋臭防臭球杀菌喷雾家用清香
222140120514,2022-05-15 22:31:43,￥9.7,交易成功,尿碱溶解剂洁厕灵马桶厕所清洁剂强力除垢顽固污垢卫生间清除剂
25547942919,2022-05-15 22:28:31,￥16.8,交易成功,【半年装3大桶】立白茶籽洗洁精天然茶籽除菌去油食品级果蔬可用
126601629671,2022-05-15 21:32:54,￥23.9,交易成功,张小泉厨房剪刀家用不锈钢鸡骨剪强力多功能杀鱼肉骨食物剪子专用
351471393246,2022-05-15 21:22:36,￥6.46,交易成功,油烟机吸油棉油盒油槽垫纸长条形通用油杯垫厨房家用加厚吸油纸
324640223717,2022-05-15 17:23:55,￥9.8,交易成功,浴室拖鞋架壁挂式室内家用毛巾鞋子收纳神器墙壁门后挂架置物架
304510906661,2022-05-15 15:01:09,￥4.98,交易成功,文艺拿苹果公主iPhone13Pro max苹果12手机壳11透明7/8plus软套XR
309034541927,2022-05-14 18:27:15,￥31.51,交易成功,希斯朵韩式加厚收纳箱大号抽屉整理有盖塑料储物箱衣服衣柜杂物盒
223509393471,2022-05-13 12:38:36,￥7.5,交易成功,风扇罩防夹手保护网罩小孩安全罩子电风扇套子儿童防护风扇防尘罩
6371285042,2022-05-12 21:05:56,￥12.7,交易成功,插座保护盖儿童防触电安全塞堵电源插排保护套婴儿插头插孔防护盖
288910776791,2022-05-10 17:49:02,￥305.72,交易成功,好奇金装纸尿裤S/M/L/XL男女宝宝超薄透气好奇正品尿不湿云柔干爽
285127443431,2022-05-08 10:07:58,￥10.9,交易成功,苏诺洗碗海绵清洁百洁擦双面加厚厨房抹布不粘油家用刷锅洗碗神器
8701621782,2022-05-08 10:02:59,￥14.8,交易成功,妙洁钢丝球厨房用品粗钢丝球清洁球洗碗刷锅不生锈不掉丝包邮
54225149902,2022-04-27 19:30:31,￥20.9,交易成功,爱格胶棉海绵拖把头各种配件各型号免手洗平板旋转拖把替换布头
203435841617,2022-04-27 19:28:17,￥9.99,交易成功,正品爱格JP06替换布免手洗拖把头粘贴式平板拖把布加厚拖把布配件
287798856424,2022-04-27 00:06:54,￥25.96,交易成功,李佳琦推荐烟酰胺身体乳女夏季清爽不油腻保湿补水香体乳持久留香
245265296884,2022-04-26 23:53:27,￥7.44,交易成功,FaSoLa 一次性脚膜套 防干裂塑料透明足套泡脚试鞋套防水足疗脚套
301221207060,2022-04-26 23:48:45,￥5.19,交易成功,洗杯刷子无死角实木长柄洗杯子神器奶瓶刷子水杯暖瓶破壁机清洁刷
273760873541,2022-04-26 23:17:23,￥6.92,交易成功,厨房灶台刷煤气灶刷子强力去污清洁刷子除锈抛光油烟机清洁刷铜丝
325952241102,2022-04-26 22:27:46,￥16.9,交易成功,免抽气挂式真空压缩袋厚衣服冬衣外套挂衣袋棉袄羽绒服收纳袋挂袋
9136234844,2022-04-26 22:23:24,￥38.25,交易成功,太力真空压缩袋免抽气棉被衣物收纳特大袋子家用立体整理打包神器
1454090276,2022-04-26 22:13:48,￥10.8,交易成功,加厚金刚砂海绵擦锅底洗锅神器除垢去污魔力铁锈不锈钢锅清洁刷锅
3329780471,2022-04-26 22:12:02,￥38.9,交易成功,油烟机清洗剂厨房强力去油污多功能泡沫清洁剂厨房家用油污净神器
3363066720,2022-04-26 22:06:14,￥15.8,交易成功,玻璃清洗剂擦窗器家用擦洗窗户玻璃水强力去污浴室玻璃门窗清洁剂
226393014564,2022-04-26 22:02:57,￥12.44,交易成功,大理石台面渗色清除剂瓷砖染色清洁剂石英石渗透污渍去污深层清洗
324998249679,2022-04-26 22:00:52,￥29.88,交易成功,地板清洁剂拖地清洁液清洗剂抑菌瓷砖留香强力去污神器一拖净沫檬
67147443364,2022-04-26 21:50:43,￥30.27,交易成功,超护食品级一次性PVC手套防水防油餐饮乳胶橡胶家用美容手套批发
333382909653,2022-04-21 21:12:56,￥11.57,交易成功,男童袜子春夏薄款透气网眼袜夏季男孩吸汗卡通恐龙袜宝宝儿童袜子
7888729873,2022-04-21 21:12:13,￥13.8,交易成功,儿童袜子夏季春秋薄款冰丝纯棉夏天男童女童透气中筒网眼超薄宝宝
245603640326,2022-04-21 19:04:54,￥9.9,交易成功,【食品级】吸管一次性孕产妇独立包装透明家用弯头儿童吸管软管儿
446934632,2022-04-18 19:38:13,￥18.99,交易成功,雨衣电动车电瓶车雨披加长款全身防暴雨单人双人时尚加大加厚男女
296572739247,2022-04-18 19:34:56,￥25.9,交易成功,儿童雨鞋男童女童宝宝小童雨靴防滑防水幼儿卡通加绒收口学生水鞋
336463655090,2022-04-18 19:22:49,￥22.8,交易成功,一次性食品级防护防水防油洗碗餐饮乳胶橡胶美容透明加厚PVC手套
243633101373,2022-04-17 15:23:26,￥28.9,交易成功,雀巢淡奶油250ml 动物性稀鲜奶油烘焙原材料做蛋糕
217706557928,2022-04-16 20:41:27,￥22.41,交易成功,小恐龙儿童雨衣幼儿园小学生男童女童雨鞋
251695805485,2022-04-14 16:01:40,￥16.9,交易成功,刘海矫正直发膏小红书改旋角蛋白烫剂软化水中分叉固定永久
223799178804,2022-04-14 15:59:28,￥13.92,交易成功,醋酸发簪简约现代日常盘发簪子一字韩式小众冷淡风筷子发饰头饰女
107557484360,2022-04-14 15:56:48,￥5.9,交易成功,发卡钢夹子头饰小卡子发夹黑色女一字夹韩版发饰刘海盘发顶夹成人
263827534750,2022-04-13 16:06:12,￥8.71,已发货，退款成功,【买1送一】儿童老人挂钥匙绳小学生挂脖防丢钥匙圈手工结实耐用
48285202761,2022-04-13 15:59:50,￥4.83,交易成功,达菲熊史黛拉手机挂绳布艺加宽挂脖长绳短绳手腕钥匙U盘芭蕾兔
218176313667,2022-04-08 08:44:54,￥5.51,交易成功,椅子桌脚垫椅子脚套凳子沙发静耐磨防滑家具地板保护垫桌脚保护贴
25892295651,2022-04-04 23:13:19,￥25.9,交易成功,蒙氏教具学习知识分类盒蒙台蒙特梭利早教益智幼儿园数学启蒙玩具
275225605756,2022-04-04 23:04:47,￥16.9,交易成功,方向思维颜色排序游戏幼儿园中班益智区域投放材料自制桌面玩教具
227380488377,2022-04-04 23:01:06,￥7.9,交易成功,宝宝认识颜色分类杯幼儿童配对认知启蒙训练教具蒙氏早教益智玩具
211791591991,2022-04-04 22:54:18,￥10.4,交易成功,儿童益智配对拼图认知卡片撕不烂幼儿园小朋友宝宝早教玩具拼图卡
451392920,2022-04-04 22:48:45,￥6.8,交易成功,串珠婴儿玩具木制 虫吃苹果穿绳游教具儿童早教益智一岁宝宝玩具
308723449779,2022-04-04 22:40:54,￥11.9,交易成功,婴幼儿童串珠子玩具益智力男女孩4宝宝动脑早教1一2岁3穿绳线积木
239583842380,2022-04-04 22:23:49,￥14.89,交易成功,36色绘画套装三角蜡笔不脏手儿童画笔彩色油画棒幼儿园塑料涂色笔
324424364378,2022-04-04 17:53:06,￥39.8,交易成功,大开本自然物语儿童科普启蒙绘本3-6-8岁宝宝故事书科普认知绘本
289934080568,2022-04-04 17:52:07,￥28.8,交易成功,去野外-看路边的奇花异草+吃田间的美味果蔬正版精装科普硬壳绘本
36522748900,2022-04-04 17:51:34,￥9.9,交易成功,包邮 童眼识天下科普馆 绚丽的花儿花朵科普百科全书儿童阅读书籍
298027112756,2022-04-04 17:38:25,￥72.8,交易成功,宝宝洞洞推拉书儿童3D立体机关洞洞书3-6岁认知早教益智启蒙书
289659216357,2022-04-04 17:37:02,￥38.8,交易成功,撕不烂洞洞书中英双语0-1-2-3岁宝宝早教翻翻书1岁半幼儿益智玩具
205360964035,2022-04-04 11:38:46,￥8.9,交易成功,活页环开口装订圈可拆卸圆环扣铁手账打孔活页夹金属固定DIY书圈
223148845612,2022-04-03 17:08:31,￥50,交易成功,大46cm西洋剑泡泡棒批发吹泡泡儿童泡泡水泡泡器玩具地推摆摊货源
212854018433,2022-04-01 15:28:02,￥6.77,交易成功,儿童彩色剪纸益智玩具套装送剪刀小孩礼物手工制作幼儿园教学用品
244294989480,2022-03-30 22:37:58,￥25.29,交易成功,HUYO捣汁棒304不锈钢捣碎棒柠檬碎冰锤水果压汁棒奶茶店冰锤冰棒
202567173195,2022-03-29 23:58:00,￥9.51,交易成功,小红书同款矫正刘海lash up在家DIY自用改善头发有旋角蛋白烫刘海
283485049254,2022-03-29 19:05:40,￥19.9,交易成功,窗户限位器纱窗锁卡扣儿童锁窗户安全防开外推平开窗户推拉门锁扣
621270016,2022-03-29 18:50:05,￥9.9,交易成功,looktosee儿童安全锁扣宝宝抽屉锁防夹手冰箱锁橱柜门马桶 安全锁
43022597884,2022-03-28 10:50:54,￥158.85,交易成功,乐的小黄鸭平衡车儿童无脚踏1-3岁2宝宝玩具车学步滑行溜溜扭扭车
223148845612,2022-02-28 16:36:07,￥50,交易成功,大46cm西洋剑泡泡棒批发吹泡泡儿童泡泡水泡泡器玩具地推摆摊货源
78968232932,2022-02-14 11:57:19,￥7.96,交易成功,儿童衣架婴儿宝宝衣架子新生儿衣撑晾衣架衣服挂多功能衣服架子
67147443364,2022-02-11 23:48:24,￥30.27,交易成功,超护食品级一次性PVC手套防水防油餐饮乳胶橡胶家用美容手套批发
240158532932,2022-02-11 23:44:59,￥9.9,交易成功,【收藏先发货】凡士林经典修护晶冻保湿防干燥防裂男女滋润全身用
8009255545,2022-02-06 16:17:59,￥25.8,已发货，退款成功,儿童会说话的洋娃娃仿真娃娃婴儿玩具女孩软胶睡眠宝宝可爱布娃娃
89865653346,2022-02-06 16:16:03,￥21.44,交易成功,儿童戏水玩具水车女孩男孩宝宝洗澡玩具套装婴儿大黄鸭水车转转乐
59236753038,2022-02-06 16:03:35,￥6.8,交易成功,八爪鱼头部按摩器灵魂提取挠头挠痒抓头皮神器经络痒痒放松摄取器
8009255545,2022-02-06 15:58:05,￥25.8,交易成功,儿童会说话的洋娃娃仿真娃娃婴儿玩具女孩软胶睡眠宝宝可爱布娃娃
104067655175,2022-01-26 07:46:49,￥109.72,交易成功,儿童桌椅套装家用宝宝学习桌幼儿园小桌子椅子塑料玩具桌写字书桌
94917008596,2022-01-26 07:24:34,￥8.79,交易成功,儿童过家家厨房玩具套装宝宝女孩男孩仿真炒菜做饭餐具厨具切切乐
191505660077,2022-01-26 07:12:00,￥5.71,交易成功,蒙氏几何形状套柱配对积木拼装儿童启蒙早教益智玩具1-3岁男女孩
220601323810,2022-01-25 15:42:30,￥12.9,交易成功,儿童可拆卸军事车男孩玩具益智拼装玩具车套装工程车消防车3-6岁2
220601323810,2022-01-25 15:41:36,￥12.9,交易成功,儿童可拆卸军事车男孩玩具益智拼装玩具车套装工程车消防车3-6岁2
303632764238,2022-01-25 15:35:38,￥15.8,交易成功,儿童洗漱巾婴儿毛巾刷牙擦脸漱口水巾防水围嘴不湿衣宝宝洗脸围兜
255257627405,2022-01-25 15:32:10,￥40.5,已签收，换货/补寄成功,儿童按压小汽车挖掘机挖土机工程车套装惯性回力车男孩3-6岁玩具5
99465668042,2022-01-25 15:30:27,￥36.6,交易成功,大号儿童消防车玩具套装惯性车救火洒水车工程车男孩汽车玩具模型
53406882,2022-01-25 15:25:27,￥24.23,交易成功,儿童过家家仿真切水果玩具蔬菜披萨切切乐塑料玩具果套装
226707854468,2022-01-25 15:15:55,￥51.9,交易成功,会说话的早教点读机幼儿早教儿童学习机点读启蒙玩具可充电
252203319301,2022-01-25 15:12:39,￥19.79,交易成功,儿童仿真动物模型玩具套装农场野生动物鸡鸭鹅狗猪老虎狮子斑马
291568896295,2022-01-25 15:07:56,￥22.86,交易成功,仿真动物模型桶装实心恐龙海洋迷你小动物地摊玩具男女孩生日礼物
115889169987,2022-01-25 14:58:24,￥34.78,交易成功,儿童仿真海底海洋动物昆虫生物模型昆虫海豚龟抹香鲸大白鲨龙虾蟹
6107762294,2022-01-23 19:50:28,￥28.78,交易成功,儿童购物车玩具女孩过家家大号仿真超市手推切水果蔬菜套装
6107762294,2022-01-23 19:49:23,￥28.78,已发货，退款成功,儿童购物车玩具女孩过家家大号仿真超市手推切水果蔬菜套装
183087354993,2022-01-23 18:20:17,￥17.79,交易成功,放筷子的架子多功能筷架筷枕头搁置筷子架筷子托筒勺子托筷子架
294002242348,2022-01-20 19:40:25,￥6.79,交易成功,包邮塑料膨胀螺丝钉铁膨胀管铁涨塞轻型砖墙膨胀螺丝膨胀钩钻头【2月15日发完】
277061284692,2022-01-15 09:38:58,￥19.38,交易成功,蒙氏衣饰板早教儿童穿衣学习板毛毡插扣系鞋带钮扣教学布书忙碌板
309109024960,2022-01-14 20:31:43,￥4.95,交易成功,【2022虎年红包】创意虎年虎虎生威折叠红包春节表白生日大礼包
315077215603,2022-01-14 19:04:08,￥10.78,交易成功,宝宝袖套婴幼儿可爱儿童套袖小男孩女童婴儿护袖头纯棉防水秋冬季
15293606696,2022-01-13 18:29:08,￥7.21,交易成功,韩国椭圆扁框ins潮流网红眼镜女红色带链条墨镜男小脸百搭太阳镜
15293606696,2022-01-13 18:28:56,￥7.21,交易成功,韩国椭圆扁框ins潮流网红眼镜女红色带链条墨镜男小脸百搭太阳镜
177518988648,2022-01-11 10:33:08,￥27.02,交易成功,第伊洁304不锈钢防臭地漏淋浴厕所卫生间下水道洗衣机两用浴室
177518988648,2022-01-11 10:32:18,￥27.02,交易成功,第伊洁304不锈钢防臭地漏淋浴厕所卫生间下水道洗衣机两用浴室
191463899798,2022-01-07 14:38:05,￥6.79,交易成功,四分之一云台底座转换1/4转3/8三脚架4分1螺钉相机快装板螺丝转接
207742318669,2022-01-06 19:35:58,￥8.79,交易成功,公主切刘海发姬发式仿真发丝二次元刘海假发女修脸网红姬发假发片
216442984646,2022-01-06 15:53:05,￥13.89,交易成功,潍坊风筝新款烫金金鱼传统风筝大中小款儿童成人微风易飞简单上手
110511296342,2022-01-06 15:49:03,￥8.39,交易成功,大红冬瓜灯笼广告拉丝灯笼红灯笼舞蹈道具装饰户外饭店农家乐防雨
222953364033,2022-01-01 13:46:07,￥11.89,交易成功,Gopro Hero9/8/7/6/Insta360项圈挂脖子Vlog路亚钓鱼手机支架配件
308304103131,2022-01-01 13:44:06,￥4.6,交易成功,高马尾抓夹固定神器秋冬小发夹女后脑勺小号鲨鱼夹夹子头饰发饰
279337407705,2021-12-27 16:30:36,￥9.5,交易成功,尔木萄粉扑北斗七星气垫不吃粉底液超软美妆蛋化妆海绵散粉扑葡
312504347810,2021-12-25 15:30:20,￥23.2,交易成功,PRAMY/柏瑞美定妆喷雾防水美妆油皮不脱妆散粉持久控油博瑞便携带
291144891785,2021-12-25 15:28:27,￥22.9,已发货，退款成功,PRAMY/柏瑞美定妆喷雾旅行装30ml持久不脱妆保湿控油快速定妆学生
284382924471,2021-12-25 15:21:07,￥25.99,交易成功,TIMAGE彩棠大师高光修容盘分装小样两用三色鼻影阴影侧影一体盘
305441004174,2021-12-25 15:18:48,￥16.96,交易成功,正品韩国UNNY VXDU三色眉粉盘眼影修容盘防水防汗不易脱色不晕染
226698696077,2021-12-25 14:57:54,￥24,交易成功,KATO眼线胶笔防水防汗持久极细细头眼线液笔白色防水不晕染彩色棕
293144669609,2021-12-25 14:56:44,￥34,交易成功,EVERBAB艾蓓拉单簇假睫毛女自然A型鱼尾混合装仙子毛嫁接眼睫毛
248251964181,2021-12-25 14:02:04,￥39.87,交易成功,UNNYCLUB眼影盘四色2021年新款夏天大地色小众品牌ins超火高颜值
314135677835,2021-12-25 13:46:12,￥102.5,交易成功,EVERBAB蛋卷卷发棒便携式电卷棒大波浪懒人水波纹防烫夹板艾蓓拉【12月31日发完】
310275648698,2021-12-25 13:45:48,￥39.89,已发货，退款成功,头卷发棒水波纹波浪鸡蛋糕大卷神器懒人玉米烫夹板电卷发器女
183369245096,2021-12-25 12:17:18,￥20.15,已发货，退款成功,荣事达抗菌饺子盒多层家用冰箱速冻水饺盒馄饨保鲜储物密封收纳盒
302042039058,2021-12-21 21:50:22,￥9.9,交易成功,儿童投影手电筒圣诞节礼物早教玩具发光圣诞玩具节日礼物七彩手电
225144362541,2021-12-21 21:48:31,￥35.69,交易成功,家用折叠篮球框儿童室内户外篮球架宝宝免打孔运动球幼儿球类玩具
2638941402,2021-12-21 21:41:47,￥10.57,交易成功,皮球儿童幼儿充气玩具球玩具手抓球宝宝球类小篮球小足球幼儿园
191379645182,2021-12-20 14:19:35,￥12.88,交易成功,【买一送一】帽子男女春夏防晒遮阳鸭舌帽学生秋冬韩版休闲棒球帽
130181903800,2021-12-12 13:46:21,￥7.42,交易成功,剪发围布斗篷理发围布不沾发剪头发围布儿童成人美发围裙用品披肩
2010800337,2021-12-10 17:10:01,￥9.9,交易成功,洗碗加绒手套神器防水乳胶女洗衣服刷碗胶皮橡胶耐用冬天保暖耐磨
193149606971,2021-12-09 21:02:14,￥11.68,交易成功,堆堆袜纯棉秋冬袜子长袜女款初秋网红爆款韩版潮流中筒日系长筒袜
141575934186,2021-12-06 16:46:49,￥9.36,交易成功,婚纱头饰新娘头纱拍照网红自拍简约超仙森系白色遮面短款裸纱
284901154925,2021-12-06 15:44:21,￥5.98,交易成功,「贝里丝小姐」法式复古港风珍珠丝绒酒红蝴蝶结少女过年耳环耳夹
270581867328,2021-12-06 15:03:42,￥19.9,交易成功,拍照道具金属大力夹摄影夹子架强力铁夹硫酸纸夹摄影棚布摄影配件
97358898999,2021-12-04 15:33:19,￥7.13,交易成功,松果100个混合尺寸手工diy装饰松果画幼儿园圣诞松果一手货源批发
206872840885,2021-12-04 15:15:43,￥19.6,交易成功,圣诞节装饰雪人娃娃公仔桌面圣诞老人摆件可爱创意礼品送女友孩子
291005442299,2021-12-04 15:12:04,￥10.78,交易成功,仿真雪花人造雪喷雪罐泡沫喷雾剂儿童节六一圣诞节飞雪喷雪喷雾器
247911595327,2021-11-29 22:34:30,￥73,交易成功,神牛摄影反光板椭圆形可折叠便携迷你反光布柔光板遮光布补光板
292771690346,2021-11-17 16:40:14,￥68.8,交易成功,圣诞树1.5米1.8/2.1/2.4/3米圣诞节装饰品酒店场景布置家用圣诞树
228974763362,2021-11-16 10:49:14,￥30,交易成功,纯黑色拍照背景布网红摄影道具直播黑布背景立体墙幕布吸光不反光
4366064626,2021-11-16 10:27:30,￥25.8,交易成功,三曼多油纸伞舞蹈伞旗袍秀汉服伞古装吊顶装饰COS古风女古典江南
4427184866,2021-11-10 14:16:42,￥6,交易成功,【圣诞包装纸】礼物礼品包装纸ins风手工花束鲜花圣诞节礼盒包装
4427184866,2021-11-10 14:16:27,￥6,交易成功,【圣诞包装纸】礼物礼品包装纸ins风手工花束鲜花圣诞节礼盒包装
168732178042,2021-10-26 11:39:26,￥12.23,交易成功,幼儿园安静书圆形魔术贴手工背胶子母扣小圆点超薄透明自粘射出勾
1401297873,2021-10-26 11:19:28,￥6.54,交易成功,粘鞋专用胶运动鞋球鞋皮鞋修鞋匠沾鞋树脂胶软性防水强力补鞋胶水
18541377617,2021-10-26 11:16:55,￥12.5,交易成功,玻璃胶防水防霉厨卫透明中性硅胶家用封边黑色窗缝马桶密封胶
230679436982,2021-10-13 17:12:57,￥21.8,交易成功,透明打孔夹小清新打孔文件夹A4打孔2孔快劳夹活页夹插页D形双孔夹
230182953090,2021-10-10 10:12:06,￥15.15,交易成功,集成吊顶led灯 厨房卫生间灯铝扣板嵌入式30x30x60x300x600平板灯
272747589626,2021-10-09 10:19:35,￥6.93,交易成功,星黛露抓夹卡通毛绒发夹女大号后脑勺发卡发抓夹子头饰可爱鲨鱼夹
236591150474,2021-10-07 17:36:37,￥2.79,交易成功,小画家不脏手塑料蜡笔儿童画笔24色36色绘画油画棒三角形彩色腊笔
264674393198,2021-10-07 17:25:40,￥4.88,交易成功,桌子脚套凳子脚垫防滑静音耐磨椅子垫通用加厚硅胶桌角椅子保护套
100765577910,2021-10-07 17:21:34,￥18.86,交易成功,罩衣儿童宝宝吃饭围兜儿童罩衣宝宝罩衣男女纯棉春秋防水防脏围兜
247996513735,2021-10-07 13:00:31,￥125,交易成功,儿童踩脚凳宝宝洗手梯子洗漱台脚踏凳楼梯台阶蹬幼儿卫生间垫脚凳
262420345972,2021-10-06 13:20:26,￥15.8,交易成功,飞利浦节能灯泡螺旋型e27e14螺口荧光灯家用电超亮日光螺纹5W8W新
271079475338,2021-10-06 09:23:34,￥11.33,交易成功,宝宝地板袜春秋纯棉婴儿防滑袜隔凉透气室内学步袜套儿童卡通蹦床
94897466390,2021-10-05 16:34:18,￥11.16,交易成功,【吉他背带】民谣吉他背带电吉他尤克里里背带男女经典款斜跨肩带
1961167619,2021-10-02 10:52:05,￥28.9,交易成功,芊云婴儿童防撞条防撞角加厚加宽宝宝防护条角玻璃防碰桌子包边条
8829472205,2021-10-02 10:50:06,￥16.5,交易成功,霞光A4塑封膜7C护卡膜10c过塑膜8S过胶膜a4照片保护膜7丝相片过胶
221662015334,2021-09-28 18:54:37,￥6.99,交易成功,无痕钉相框挂钩免打孔强力壁挂画婚纱照片墙钉子专用挂钉墙钉隐形
177022709072,2021-09-24 22:20:53,￥36.77,交易成功,幼儿童早教机会说话的早教书故事书益智女孩学习机点读机玩具男孩
213952997149,2021-09-24 16:53:50,￥85,交易成功,古德290照片塑封机A4过胶机小型过塑机家用相片封塑机纸张压膜机
100104584698,2021-09-24 16:27:10,￥8,交易成功,清水练字中号空白水写布0.7米*42cm米格加厚学生初学者用水写布
254422091606,2021-09-22 15:17:02,￥138,已签收，退款成功,新生儿宝宝婴儿监护器啼哭提醒看护器哭声报警老人无线呼叫机家用
164262332393,2021-09-03 13:52:53,￥2.64,交易成功,宝宝量脚器 儿童鞋内长测量脚长尺子婴儿量鞋码0-8岁买鞋神器家用
150961583763,2021-09-02 21:32:39,￥8.17,交易成功,宝宝抽屉锁儿童安全锁扣柜门锁婴儿防夹手柜子锁儿童抽屉锁防护锁
254197625956,2021-09-02 20:51:26,￥21.88,已签收，退款成功,婴幼儿童加厚加宽防撞条角寝室墙壁梯子包边条宝宝玻璃桌子防碰
164091526096,2021-09-02 14:34:25,￥16.68,交易成功,教学教具背胶磁条磁条贴片磁性磁片薄软磁强力贴磁力黑板吸铁石
134523555391,2021-09-01 23:32:28,￥23.68,交易成功,鼓牛皮小孩儿童玩具鼓幼儿园大小鼓敲打鼓堂鼓锣鼓打击乐器批发
234659409565,2021-09-01 23:30:29,￥46.8,交易成功,幼儿园奥尔夫打击乐器儿童原木套装木质玩具教具铃鼓三角铁双响筒
152047995742,2021-09-01 23:16:26,￥4.5,交易成功,拼接软镜子家用贴墙自粘穿衣镜全身镜亚克力化妆镜浴室镜子可定制
214796180603,2021-09-01 14:29:42,￥149,交易成功,儿童绘本架家用落地书架儿铁艺移动置物架简易书柜宝宝玩具收纳架
601599267,2021-08-31 17:39:26,￥28.9,交易成功,宝宝幼儿童立体拼图木制早教智力拼板益智玩具1-3-6岁木钉手抓板
221732614727,2021-08-31 17:37:41,￥17.8,交易成功,幼儿童早教拼图积木男女孩木质拼版1-2-3-4岁宝宝益智力开发玩具
