订单号,下单时间,订单总价,订单状态,商品名称
330186024547,2023-07-22 10:27:57,￥4.99,交易成功,新款水滴款防撞角 透明桌角儿童防磕碰保护套 家具硅胶加厚防撞角
462043081086,2023-07-18 18:04:32,￥5.8,交易成功,凉拖鞋女家居家用室内待客人春秋夏季防滑静音防臭情侣浴室洗澡男
327944756683,2023-07-18 18:03:46,￥16.79,交易成功,买一送一拖鞋女夏季室内家居防滑防臭凉耐磨软底家用批发宿舍凉拖
327944756683,2023-07-18 18:03:11,￥16.79,交易成功,买一送一拖鞋女夏季室内家居防滑防臭凉耐磨软底家用批发宿舍凉拖
221300805717,2023-07-17 14:25:29,￥47.4,交易成功,适配科沃斯地宝t8/9一次性强拖纤维抹布T8AIVI/MAX/POWER免洗拖布
357760239841,2023-07-17 14:23:39,￥29.06,交易成功,科沃斯扫地机器人配件T9/T8/N8/T5/N5海帕过滤网芯边滚主刷清洁液
452162650113,2023-07-17 14:21:59,￥15.81,交易成功,鹅型裤架裤子衣架卧室挂衣架挂裤子专用防滑裤架柜内收纳裤子架
423758519108,2023-07-17 14:20:44,￥16.9,交易成功,简易鞋架门口家用小窄鞋柜子分层隔板宿舍省空间防尘多层收纳夹层
500743768687,2023-07-17 14:14:05,￥29.98,交易成功,沙发边几边柜边桌客厅家用茶桌置物架床头床边迷你阳台小茶几桌子
347591505923,2023-07-17 14:02:28,￥16.89,交易成功,保鲜膜切割器冰箱磁吸保鲜膜通用切割盒切割神器厨房神器锡纸切割
159873631307,2023-07-17 13:54:29,￥13.15,交易成功,鱼缸加固包边条玻璃防刮手封边条PVC凹槽水族箱U型条卡槽材料搭配
204051021770,2023-07-12 15:44:32,￥15.98,交易成功,儿童认识汽车车标图汽车卡片识图车标卡片 儿童 认知卡早教玩具
334967023835,2023-07-11 13:46:09,￥16.39,交易成功,宿舍下挂篮衣柜收纳分层神器床头置物架柜子隔板卧室床上零食架子
496487556264,2023-07-11 13:41:24,￥17.89,交易成功,神器空间置物架分层鞋架收纳隔层鞋子打孔鞋柜免内置隔板架橱柜省
470081910397,2023-07-10 18:56:57,￥15.8,交易成功,小学语文课本1-6一到六年级上下册12本全套人教部编版语文书教材
257136863692,2023-07-10 08:19:17,￥82.92,交易成功,中公2023教师资格证中学教材历年真题教资考试资料初中高中下半年
488304031234,2023-07-08 20:43:31,￥12.93,交易成功,木质衣架挂内衣背心收纳神器家用宿舍多功能无痕吊带丝巾晾衣架
225869963880,2023-07-08 20:41:24,￥6.8,交易成功,加厚304不锈钢卫生间挂钩免打孔拖把夹子挂扫把阳台家用收纳神器
325702435175,2023-07-08 11:44:38,￥7,交易成功,M6M8婴儿童床倒边螺丝钉木床书桌橱柜家具五金配件连接件锤子螺母
425367842989,2023-07-04 18:21:35,￥58.4,交易成功,全自动家用真空封口机食品包装一体机小型保鲜密封机塑封机抽真空
123984593379,2023-07-04 18:13:34,￥53,交易成功,雅柯莱D30标签机智能家用收纳开关贴姓名贴纸蓝牙学生小型打印机
447700009344,2023-06-30 10:09:01,￥36.9,交易成功,一次性马桶刷套装刷头可抛更换家用卫生间挂墙式宿舍洗厕所刷子
470683590550,2023-06-30 10:01:51,￥25.4,交易成功,加厚收纳儿童整理箱车载带盖有盖简约糖果色翻盖大容量耐用大容量
470683590550,2023-06-30 10:00:54,￥25.4,交易成功,加厚收纳儿童整理箱车载带盖有盖简约糖果色翻盖大容量耐用大容量
4572503,2023-06-09 20:41:22,￥4.26,交易成功,球针通用篮球足球充气针打气针头跳跳马游泳圈瑜伽球多功能充气嘴
473968672921,2023-06-07 17:00:17,￥49,交易成功,卡帝乐鳄鱼凉鞋男款2023夏季两用开车凉拖鞋男士轻便踩屎感沙滩鞋
210930773057,2023-06-07 16:53:16,￥11.9,已发货，退款成功,【水龙头固定神器】厨房卫生间加固防松动龙头螺母紧固件面盆通用
232209179063,2023-06-07 16:44:11,￥22.9,交易成功,墨西哥进口牛油果新鲜水果孕妇宝宝辅食大果批发整箱应当季包邮8
422024917752,2023-06-05 10:33:49,￥39.9,交易成功,雨鞋女高筒成人时尚雨靴百搭女士水鞋防滑保暖水靴女款外穿防水鞋
1454090276,2023-06-03 14:42:45,￥10.8,交易成功,加厚金刚砂海绵擦锅底洗锅神器除垢去污魔力铁锈不锈钢锅清洁刷锅
292395064820,2023-06-03 14:41:26,￥9.8,交易成功,潮洁洗手盆漏水塞子水槽洗脸面盆池弹跳芯下水器按压式防臭板配件
452427250203,2023-05-30 17:14:12,￥12.99,交易成功,超大号发夹发量多高级感盘发抓夹女优雅气质鲨鱼夹后脑勺发卡头饰
379441065480,2023-05-27 19:24:03,￥34,交易成功,集成吊顶led灯 厨房灯卫生间灯嵌入式吸顶灯led平板灯300*300*600
445869917039,2023-05-27 19:17:48,￥28.8,交易成功,美的风扇底座通用落地式地座电风扇底盘FS40配重块螺丝支撑固定盘
345086783410,2023-05-27 19:14:56,￥17.28,交易成功,儿童防晒遮阳帽夏防紫外线太阳帽男童女孩透气防晒帽大帽檐渔夫帽
473968672921,2023-05-27 19:09:37,￥49,交易成功,卡帝乐鳄鱼凉鞋男款2023夏季两用开车凉拖鞋男士轻便踩屎感沙滩鞋
315072989326,2023-05-24 08:46:54,￥20.38,交易成功,ourberga衣物去油渍清洁剂清洗油迹污渍油污除渍衣服去污去油神器
414378061832,2023-05-22 18:34:00,￥25.18,交易成功,牛油果进口水果新鲜大果墨西哥鳄梨孕妇宝宝营养辅食应季水果
365302537046,2023-05-07 10:23:24,￥109.84,交易成功,【旗舰店】飞利浦led吸顶灯磁吸灯芯圆形改造灯板改装模组环形管
140565352992,2023-04-30 18:53:46,￥28.77,交易成功,防丢儿童安全绳防走失带牵引绳宝宝防丢失手环防丢绳背带溜娃神器【7天内发货】
252055621153,2023-04-30 11:40:27,￥27,已签收，退款成功,【购买前须联系客服确认】补收差价专用商品
391561931634,2023-04-30 10:13:17,￥11.6,交易成功,A4加厚资料册活页文件夹透明插页袋档案册多层乐普文件夹办公用品
71076894554,2023-04-25 10:03:46,￥28,交易成功,拉杆行李箱把手配件耐用提手配件皮箱旅行箱把手拉手维修通用拎手
37792976942,2023-04-20 20:50:01,￥7.88,交易成功,宜家弗拉塔大号蓝色环保购物袋编织袋搬家袋子打包收纳行李储物袋
295286728584,2023-04-19 19:26:46,￥178.81,交易成功,好奇金装成长裤超薄透气新品婴儿用品尿不湿拉拉裤多规格可选
234620201072,2023-04-19 19:21:40,￥12.98,交易成功,高粘度免钉胶贴墙专用粘得牢置物架镜子万能多功能免打孔强力胶水
395812062726,2023-04-17 08:44:30,￥15.64,交易成功,厨房点火器长打火机煤气灶充电创意防风脉冲点火枪USB电子点火棒
134495641154,2023-04-15 19:19:16,￥19.34,交易成功,小米监控摄像头tf卡专用内存卡MicroSD卡家用监控摄像头FAT32储存
228784453434,2023-04-03 19:38:16,￥13.8,交易成功,幼儿园阅读绘本儿童3到6岁宝宝小班中班大班早教启蒙绘本故事书籍
383394507869,2023-04-03 19:16:36,￥9.9,交易成功,四大名著思维导图漫画版画册人物关系图西游记水浒传三国演义红楼
364557822221,2023-04-03 11:01:06,￥12.8,交易成功,儿童安全教育性格情绪逆商培养绘本全60册 0-3-6岁幼儿早教故事书
352775087365,2023-04-03 10:58:59,￥23.8,交易成功,儿童拒绝欺凌自我保护图画书 3-4-5-6-7岁幼儿园宝宝逆商培养绘本
327491471636,2023-04-03 10:57:39,￥19.83,交易成功,儿童逆商培养和挫折教育绘本 幼儿园老师推荐亲子阅读带拼音的适
255425563244,2023-04-03 10:49:11,￥168.87,交易成功,牛津树红标橙标1-12阶段全套点读版小达人学校版校园版高品质团购【4月30日发完】
286619148650,2023-04-03 10:44:30,￥55.94,交易成功,SSS双语歌词本156首练习册300页闪卡410面支持小达人小蝌蚪点读【4月27日发完】
424813951868,2023-03-25 10:03:13,￥10.79,交易成功,大容量抽绳束口袋水洗超市买菜购物袋手提收纳袋可折叠便携买菜包
223908522467,2023-03-24 16:41:12,￥15.79,交易成功,羽衣甘蓝新鲜蔬菜嫩叶甘兰芥蓝菜叶雨衣kale西餐沙拉榨汁食材现摘
350815509845,2023-03-24 16:34:27,￥9.89,交易成功,低脂黑芝麻贝果面包无蔗糖食品全麦面包欧包杂粮健身代餐轻食饱腹
180148369592,2023-03-24 16:33:20,￥11.89,交易成功,低脂全麦卷饼荞麦粗粮手抓饼葱香饼轻卡速食健身代餐粗粮早餐薄饼
280484756904,2023-03-21 20:12:27,￥15.59,交易成功,【新店开业!冲量!】墨西哥牛油果新鲜大果鳄梨宝宝辅食新鲜水果
267735260394,2023-03-14 09:52:42,￥39.57,交易成功,儿童连体下水裤幼儿园玩沙衣服抓捕鱼小孩赶海防水雨裤雨鞋男女童
267735260394,2023-02-28 16:13:43,￥39.57,交易成功,儿童连体下水裤幼儿园玩沙衣服抓捕鱼小孩赶海防水雨裤雨鞋男女童
346677466180,2023-02-26 21:25:24,￥86,交易成功,A类抗菌防螨床笠单件夹棉加厚席梦思床垫保护套防滑床罩防尘床套
346677466180,2023-02-26 21:24:58,￥86,交易成功,A类抗菌防螨床笠单件夹棉加厚席梦思床垫保护套防滑床罩防尘床套
346677466180,2023-02-26 21:24:35,￥86,交易成功,A类抗菌防螨床笠单件夹棉加厚席梦思床垫保护套防滑床罩防尘床套
238232952873,2023-02-24 21:51:58,￥14.8,交易成功,倍量5号7号充电电池充电器套装可充电五号七号1200替代1.5v锂电AA
224610940529,2023-02-15 12:09:42,￥14.9,交易成功,妙洁PE保鲜膜点断式大卷家用经济装厨房食品级冰箱耐高温一次性
370706918816,2023-02-15 12:08:07,￥15.88,交易成功,排油烟机吸油棉加厚长条形接油槽专用通用型厨房吸油棉蓝膜防渗漏
403417050835,2023-02-07 13:55:10,￥119,交易成功,清仓大特惠正品好奇金装纸尿尿不湿包邮XL108片破损
444204991326,2023-02-06 21:25:33,￥19.79,交易成功,正品凡士林水润护脚膏护足霜脚后跟开裂防裂滋润皲裂膏护手霜修复
382725271807,2023-01-30 19:01:39,￥324.99,交易成功,贝琦童儿童自行车男孩2-3-6-7-9岁5中大童小女孩脚踏单车宝宝童车
275741195009,2023-01-30 18:17:39,￥29.8,交易成功,欧乐多切菜器抗菌316不锈钢土豆切丝器多功能手动柠檬切片器超细
408603017362,2023-01-30 12:07:13,￥39.8,交易成功,科巢儿童筷子虎口训练筷2 3 6-12岁宝宝学习练习筷幼儿练习餐具
343465258912,2023-01-29 16:05:08,￥8.7,交易成功,得力柔彩软头荧光笔学生用划重点标记笔笔头圆杆彩色记号笔手账笔
593360768,2023-01-29 14:27:44,￥16.9,交易成功,网红四季通用宠物狗窝垫子泰迪猫窝小型中型大型犬泰迪宠物用品床
262380963901,2023-01-24 21:09:26,￥49.31,交易成功,收纳箱大容量特大号衣服收纳箱塑料汽车储物箱书本整理箱收纳盒箱【15天内发货】
206437042434,2023-01-24 20:57:43,￥43.16,交易成功,加特厚透明收纳箱塑料大小号车载家用整理装衣服玩具多功能储物盒
9175058690,2023-01-24 19:08:34,￥14.6,交易成功,迪福德衣柜滑轮不锈钢下轮凸轮浴室钛合金隔断推拉移门滚轮子轱辘【2月5日发完】
168999716964,2023-01-24 18:10:17,￥18.31,交易成功,卡贝抽屉滑轨阻尼缓冲三节轨道滑道电脑键盘桌静音导轨不锈钢滑轨
428474470893,2023-01-24 18:00:32,￥185.5,交易成功,免安装收纳柜收纳置物架折叠收纳箱客厅收纳神器衣服置物柜开门式【1月31日发完】
428474470893,2023-01-24 17:55:00,￥185.5,交易已取消,免安装收纳柜收纳置物架折叠收纳箱客厅收纳神器衣服置物柜开门式【1月31日发完】
67147443364,2023-01-14 09:34:00,￥30.27,交易成功,超护食品级一次性PVC手套防水防油餐饮乳胶橡胶家用美容手套批发
357760239841,2023-01-12 18:09:33,￥29.06,交易成功,科沃斯扫地机器人配件T9/T8/N8/T5/N5海帕过滤网芯边滚主刷清洁液
355375417345,2023-01-10 21:36:25,￥50.58,交易成功,必联无线可视挖耳勺采耳工具全套带灯发光扣耳挖勺儿童掏耳朵神器
362131239491,2023-01-07 21:47:20,￥103.86,交易成功,华研外语英语口译入门笔记法译前阅读听辨基础训练适用catti二级
2068241424,2023-01-06 13:57:20,￥10.02,交易成功,18片英国优步熊婴儿游泳裤幼宝宝一次性泳裤游泳纸尿裤防水拉拉裤
295286728584,2023-01-06 09:19:49,￥178.81,交易成功,好奇金装成长裤超薄透气新品婴儿用品尿不湿拉拉裤多规格可选
288910776791,2023-01-06 08:53:55,￥305.72,交易已取消,好奇金装纸尿裤S/M/L/XL男女宝宝超薄透气好奇正品尿不湿云柔干爽
426848538130,2023-01-05 10:37:53,￥9.6,交易成功,晨光自动铅笔0.5学生专用写防断芯高颜值耐摔防摔0.7按动活动铅笔
300656944835,2023-01-02 16:00:19,￥14.65,交易成功,科巢一次性吸管独立包装孕妇儿童宝宝牛奶茶产后食品级可弯曲吸管
118597336329,2022-12-29 19:58:41,￥86,交易成功,安佳超高温灭菌搅打稀奶油 动物淡奶油1L 生日蛋糕diy蛋挞液材料
419698550760,2022-12-26 08:50:06,￥62.96,交易成功,亲子款电动车挡风被冬季加绒加厚防水保暖电瓶摩托车防风罩冬款
86568099638,2022-12-08 20:45:21,￥14.9,交易成功,玻璃清洁剂擦玻璃去污玻璃水洗玻璃家用浴室去水垢强力清洗剂
372230888284,2022-12-04 13:24:00,￥2.73,交易成功,晨光涂卡铅芯扁头孔庙祈福电脑答题卡笔芯方形2b铅笔芯考试专用
356362418658,2022-12-04 13:23:03,￥2.9,交易成功,得力4B橡皮擦无痕超净幼儿园儿童专用铅笔橡皮干净不掉渣学生防丢
397042759246,2022-12-04 10:06:35,￥14.85,交易成功,打印资料网上打印复印彩色印刷书本装订考研复习资料画册A4打印店
405620584957,2022-12-03 09:41:48,￥12.9,交易成功,网红爆款头绳2022年新款皮筋ins风高颜值女扎马尾发绳高弹力头饰
188361891143,2022-12-03 09:39:25,￥16.63,交易成功,得力直液式走珠笔学生用作业做功课书写用写字笔滑顺针管中性笔
426639767578,2022-12-01 23:22:33,￥9.8,交易成功,肖四肖八2023肖4肖8肖秀榮4套卷肖秀榮8套卷2023考研政治肖秀榮
426591619558,2022-11-30 20:28:02,￥28.9,交易成功,电动摩托车挡风被春秋冬季电瓶车挡风罩双面防水防风加厚加绒四季
305091169960,2022-11-30 13:05:23,￥13.03,交易成功,手套冬天女ins可爱仿麂皮开车手套秋冬季加绒保暖骑车露指触摸
298137138637,2022-11-30 12:56:28,￥13.68,交易成功,儿童帽子秋冬季立体小熊毛线帽男女童冬季卡通加厚保暖亲子毛线帽
409025369064,2022-11-30 12:54:58,￥15.8,交易成功,ins儿童帽子韩版秋冬N字母贴布针织帽男女童可爱保暖包头毛线帽潮
372269041460,2022-11-29 08:45:23,￥24.8,交易成功,公务员考试专用手表男女初高中学生简约静音潮流高考电子石英腕表
197564972537,2022-11-27 20:53:27,￥9.8,交易成功,包邮2022考研答题卡英语新版数学一二政治管理类联考答题卡作文纸
115985476192,2022-11-26 21:48:24,￥207,已签收，退款成功,皇冠防摔儿童床笠2022新款蚊帐1.8米双人加厚加密帐篷三开门1.2m5
67147443364,2022-11-23 13:34:58,￥30.27,交易成功,超护食品级一次性PVC手套防水防油餐饮乳胶橡胶家用美容手套批发
115985476192,2022-11-22 12:08:46,￥207,交易成功,皇冠防摔儿童床笠2022新款蚊帐1.8米双人加厚加密帐篷三开门1.2m5
423700581968,2022-11-18 20:27:21,￥11.89,交易成功,23徐涛考研政治预测6套卷徐涛六套卷小黄书徐涛考前预测必备20题
281575294990,2022-11-16 11:23:23,￥19.89,交易成功,儿童棉鞋女加绒加厚冬可爱外穿宝宝1-3岁学步鞋秋冬软底防滑防掉
170042835697,2022-11-16 11:21:34,￥25.78,交易成功,幸福玛丽儿童男童女童棉鞋子秋冬婴儿鞋冬加绒儿童棉拖鞋包跟女童
288910776791,2022-11-15 19:24:28,￥305.72,交易成功,好奇金装纸尿裤S/M/L/XL男女宝宝超薄透气好奇正品尿不湿云柔干爽
425853306008,2022-11-12 12:07:00,￥11.8,交易成功,陆寓丰2023考研政治冲刺预测4套卷考研政治腿姐四套卷预测卷
282935102942,2022-11-08 20:04:31,￥9.8,交易成功,2023肖秀榮考研政治精讲精练讲真题肖四肖八肖秀榮1000题形势政策
155848442482,2022-11-08 20:01:56,￥13.8,交易成功,考研专业课答题纸自命题b4b5软黄纸自主命题新传教育学333答题卡
198313249272,2022-11-01 11:29:59,￥14.59,交易成功,维克多利a4坐标纸网格纸制图图纸a3绘图纸1mm小方格学生毫米格子
422891930371,2022-11-01 10:47:15,￥11.96,交易成功,2023一笑而过英语周思成孔玮张建23考研英语视频网课电子讲义送22
422891930371,2022-11-01 10:46:16,￥11.96,已发货，退款成功,2023一笑而过英语周思成孔玮张建23考研英语视频网课电子讲义送22
42292807947,2022-10-30 11:01:15,￥9.9,交易成功,100张马卡龙色横线便利贴便签本便签纸留言记事贴N次贴便利贴学生
348019907012,2022-10-29 19:16:23,￥8.88,交易成功,2022mti翻译硕士考研catt英语笔译i热词学姐整理热词默写背诵
400721802058,2022-10-13 22:04:38,￥8.99,电子券码已使用,腿姐技巧班网课23技巧班全程班技巧课讲义2023强化班押题时政视频
92966500151,2022-10-13 21:48:29,￥15.5,交易成功,童眼识天下 认工程车 启蒙早教绘本小学生课外书籍儿童科普百科
384567932987,2022-10-13 20:55:13,￥64.8,交易成功,儿童滑板车带座三合一1-2-345-67岁男女可坐可滑行车滑滑溜溜轮车
268290025068,2022-10-06 17:44:46,￥17.8,交易成功,儿童袜子男女童春夏秋冬宝宝袜子中筒婴儿大小棉童袜四季宝宝袜子
414289241512,2022-10-06 17:29:15,￥32,交易成功,AlissaCyrine渔夫帽2022新款帽子圆脸大脸显瘦毛绒秋女冬季自闭帽
408445244401,2022-10-06 17:27:19,￥15.8,交易成功,ins宝宝帽子春秋款儿童渔夫帽男童女童水桶帽幼儿小孩盆帽韩版潮
102295953530,2022-10-06 11:06:49,￥58,交易成功,正品日本原装机芯尼康节拍器钢琴小提琴吉他古筝通用考级专用机械
188455365434,2022-10-05 19:17:08,￥35.8,交易成功,宠物狗狗体外驱虫药猫体内外一体猫咪去跳蚤狗除蜱虫虱子专用滴剂
288910776791,2022-09-29 12:54:59,￥305.72,交易成功,好奇金装纸尿裤S/M/L/XL男女宝宝超薄透气好奇正品尿不湿云柔干爽
61151794548,2022-09-28 13:13:02,￥9.8,交易成功,2022大学考研英语字帖衡水体手写印刷体高分写作范文单词英文字帖
299332009782,2022-09-28 09:03:02,￥32.9,交易成功,【刺绣标识】洗衣袋洗衣机专用网兜防变形洗护袋防缠绕内衣收纳袋
341959665648,2022-09-25 19:30:08,￥12.9,交易成功,小宠宠物猫咪狗狗滴耳液洁耳舒耳净康50ml耳螨洗耳液预防耳螨耳炎
367045845828,2022-09-25 19:06:39,￥12.9,交易成功,医用级一次性棉签单头竹棒棉花棒消毒灭菌级婴儿棉签化妆卸妆棉
413225624618,2022-09-24 19:03:59,￥14.3,交易成功,2023腿姐考研政治思维导图技巧班讲义腿姐思维导图2023技巧班讲义
316964719707,2022-09-24 12:59:36,￥23.8,交易成功,适用于华为matepad10.4保护壳荣耀5-10.1寸旋转壳畅享1/2-10.1寸
311556835212,2022-09-24 09:23:16,￥4.98,交易成功,后跟贴鞋大改小神器填充一码防掉跟鞋后跟内贴垫鞋子大了调节缩码
170523388655,2022-09-24 09:20:24,￥14.9,交易成功,儿童棉拖鞋男中小童加绒保暖秋冬季家居小孩毛拖防滑软底卡通恐龙
327944756683,2022-09-24 09:18:03,￥16.99,交易成功,买一送一情侣拖鞋家居防滑无味拖鞋女凉拖鞋软底柔软家用批发宿舍
326620812571,2022-09-24 09:14:54,￥11.9,交易成功,儿童拖鞋夏季新款一体成型男童防滑凉拖浴室卡通可爱公主女童托鞋
234213564215,2022-09-07 15:24:01,￥49.9,交易成功,美添乐滚轮拖把家用拖地神器一拖净海绵拖头懒人多功能拖布免手洗
224610940529,2022-09-07 08:48:50,￥14.9,交易成功,妙洁PE保鲜膜点断式大卷家用经济装厨房食品级冰箱耐高温一次性
307096420034,2022-09-06 14:54:26,￥8.9,交易成功,擦玻璃神器家用擦窗器清洁神器擦镜子窗户家政洗刮玻璃刮子刮水器
253477888974,2022-09-05 17:32:56,￥8.3,交易成功,100天高考中考考试倒计时日历计划本200天手撕倒计时365天提醒牌
387047059182,2022-09-04 10:35:31,￥66.89,交易成功,雅亲儿童马桶楼梯式男女宝宝专用厕所垫架台阶脚踩凳柔软坐便器圈
211416806160,2022-09-02 20:35:28,￥19,交易成功,适用于BOSE 700无线蓝牙降噪耳机套头戴式耳罩包耳式NC700皮套
243618050788,2022-08-25 10:55:49,￥33.9,交易成功,野生动物百科全书幼儿大百科全套注音版海洋恐龙枪械飞机工程百科
325597931224,2022-08-23 12:54:59,￥27.98,交易成功,韩国小红书ins男女孩宝宝周岁派对儿童生日装饰雏菊气球场景布置
45817544746,2022-08-20 08:35:31,￥79,交易成功,高姿王俊凯明星同款防晒霜喷雾女夏日开学军训必备防水汗防紫外线
288910776791,2022-08-20 08:22:52,￥305.72,交易成功,好奇金装纸尿裤S/M/L/XL男女宝宝超薄透气好奇正品尿不湿云柔干爽
326211743899,2022-08-16 14:51:14,￥39.9,交易成功,管道疏通剂强力通卫生间马桶油污堵塞地漏厨房下水道厕所除臭神器
3329780471,2022-08-16 14:39:25,￥38.9,交易成功,油烟机清洗剂厨房强力去油污多功能泡沫清洁剂厨房家用油污净神器
386153304306,2022-08-14 16:08:25,￥5.8,交易成功,洞洞橡皮擦高颜值幼儿园无毒2b橡皮干净无不掉渣小学生专用象皮4b
51404777937,2022-08-14 14:56:05,￥45,交易成功,充电防水厨房秤15kg/1g家用烘焙电子称量精准食物克称调料重小型
365730147782,2022-08-07 12:18:05,￥18.79,交易成功,欧乐多德国硅胶手套耐高温防滑防烫夹家用商用烤箱微波炉手夹耐热
365966002832,2022-08-07 11:13:37,￥10,电子券码已使用,徐涛2023考研政治网课核心考案基础班强化班全程班视频课程全家桶
220667741695,2022-08-05 15:49:57,￥54.9,交易成功,华研外语 catti英语三级笔译真题 备考2022 真题详解指南实务综合
300656944835,2022-08-05 10:01:01,￥14.65,交易成功,科巢一次性吸管独立包装孕妇儿童宝宝牛奶茶产后食品级可弯曲吸管
357156455603,2022-07-30 18:34:21,￥9.9,交易成功,迪士尼婴儿专用棉签小头化妆新生儿宝宝耳勺头掏耳朵清洁棉签棒
356629639811,2022-07-28 08:51:31,￥14,交易成功,英语专业本科生系列教材实用翻译教程冯庆华9787544613927
186413424,2022-07-27 15:35:10,￥22.61,交易成功,立式吉它地架可折叠木吉他民谣吉他架子电吉他支架琵琶A型架A架座
40751437313,2022-07-27 15:33:33,￥209,交易成功,小米摄像头1080p云台版夜视360度监控米家智能摄像机无线wifi家用
256939109376,2022-07-22 18:45:34,￥7.9,交易成功,得力荧光笔学生标记重点ins高颜值手账专用彩色笔划重点笔记号笔
8024030758,2022-07-22 18:43:37,￥8.21,交易成功,得力荧光笔记号笔粗划重点套装彩色笔标记笔粗头笔学生用手账笔
188361891143,2022-07-22 16:37:19,￥16.63,交易成功,得力直液式走珠笔学生用作业做功课书写用写字笔滑顺针管中性笔
282935102942,2022-07-15 19:39:23,￥9.8,交易成功,2023肖秀榮考研政治精讲精练讲真题肖四肖八肖秀榮1000题形势政策
27461831910,2022-07-15 08:29:54,￥17,交易成功,【官方正版】古文观止精选(英汉对照)
8795416774,2022-07-10 11:37:49,￥8.9,交易成功,点火器煤气灶脉冲点火枪厨房家用电子打火器加长燃气打火枪点火棒
309984747335,2022-07-09 11:24:16,￥8.8,交易成功,通用厨房水槽过滤网洗碗池洗菜盆下水道水池漏网垃圾残渣滤网神器
132848936,2022-07-08 19:45:48,￥6.9,交易成功,绿巨能(Llano) 读卡器内存卡多功能 TF/Micro SD卡读卡器车载迷你
197239269099,2022-07-05 18:36:22,￥14.5,交易成功,历史中考总复习 世界+中国历史速记图中外历史事件时间轴2020年版
270044736409,2022-07-05 18:35:33,￥9.9,交易成功,抖音同款】一分钟了解中国历史思维导图2米大事记画卷漫画版年表
271328507346,2022-07-05 18:34:15,￥9.8,交易成功,【共2张】透过地图看中国历史中国疆域的历史变迁朝代发展地图
330326697411,2022-07-05 18:21:20,￥29.8,交易成功,【抖音同款】中国历史常识朝代战役文人篇中小学必备历史知识挂图
374751477010,2022-07-03 18:03:30,￥39,交易成功,莫代尔带胸垫睡衣女2022年新款夏季薄款宽松短袖七分裤宽松家居服
67147443364,2022-06-26 13:17:53,￥30.27,交易成功,超护食品级一次性PVC手套防水防油餐饮乳胶橡胶家用美容手套批发
271904556250,2022-06-26 11:12:53,￥186.8,交易成功,正版现货备考2023MTI翻译硕士黄皮书 211翻译硕士英语357翻译基础
173164657511,2022-06-25 20:17:03,￥188,交易成功,好奇金装婴儿成长裤拉拉裤M56L40+8XL34+6XXL28片超薄透气
241945049611,2022-06-24 19:26:19,￥24.9,交易成功,歼20飞机合金模型军事歼15战斗机仿真金属摆件声光轰炸机玩具男孩
266928151779,2022-06-22 18:53:54,￥611.82,交易成功,小米摄像机云台版摄像头360度高清2K手机家用网络监控宠物孩子
9760143414,2022-06-22 14:38:12,￥101.84,交易成功,公牛插座板多功能墙上转换器插头一转多三无线插线板家用夜灯排插
162678761687,2022-06-17 07:44:52,￥10.89,交易成功,怀念版竹锅刷竹刷子老式环保天然竹丝炊帚强清洁洗锅除垢油污神器
